source_tx,sort_nu,category_name,rest_layer_name,label_tx,field_nm,statistic_cd,units_tx,description_tx
Service2016,77,Species: Other,NIB reptile species richness (76) ,Index of reptile species richness,Rep_All_NIB,average,unitless,"These maps model reptile species that are likely to be present in any single location within a subwatershed (12-digit HUC) in the Conterminous US as the maximum, mean, or NIB (index). These maps are based on habitat models, not wildlife observations."
Service2016,78,Species: Other,NIB small game species richness (77) ,Index of small game species,SMGA_NIB,average,unitless,The index of average (mean number of small game species per pixel divided by the maximum number of small game species in any one pixel for the entire study area) for each 12-digit HUC over the entire Southwest Region
Service2016,79,Species: Other,NIB total harvestable species richness (78) ,Index of harvestable species,Harv_NIB,average,unitless,The index of average (mean number of harvestable species per pixel divided by the maximum number of harvestable species in any one pixel for the entire study area) for each 12-digit HUC over the entire Southwest Region
Service2016,80,Species: Other,NIB total vertebrate species richness (79) ,Index of terrestrial vertebrate species,TerrVert_NIB,average,unitless,The index of average (mean number of terrestrial vertebrate species per pixel divided by the maximum number of terrestrial vertebrate species in any one pixel for the entire study area) for each 12-digit HUC over the entire Southwest Region
Service2016,81,Species: Other,NIB waterfowl species richness (80) ,Index of waterfowl species,Wtfl_NIB,average,unitless,The index of average (mean number of waterfowl species per pixel divided by the maximum number of waterfowl species in any one pixel for the entire study area) for each 12-digit HUC over the entire Southwest Region
Service2016,82,Species: At-Risk and Priority,Number of at-risk aquatic animal species observed (81) ,Total number of at-risk aquatic species,AQ_TOT,sum,count,"This map illustrates the total number of species associated with aquatic habitat that are listed as G1, G2, or in the federal endangered species program that may reside within each subwatershed (12-digit HUC)."
Service2016,83,Species: At-Risk and Priority,Number of at-risk aquatic plant species observed (82) ,Total number of at-risk wetland species,WT_TOT,sum,count,"This map illustrates the total number of species associated with wetland habitat that are listed as G1, G2, or in the federal endangered species program that may reside within each subwatershed (12-digit HUC). G1 and G2 denote Global Conservation Ranks classified by NatureServe."
Service2016,84,Species: At-Risk and Priority,Number of at-risk terrestrial animal species observed (83) ,Number of at-risk terrestrial animal species,TR_TOT_A,sum,count,"This map illustrates the total number of animal species associated with terrestrial habitat that are listed as G1, G2, or in the federal endangered species program that may reside within each subwatershed (12-digit HUC). G1 and G2 denote Global Conservation Ranks classified by NatureServe. Terrestrial habitat refers to land areas such as forests, grasslands, deserts and rainforests."
Service2016,85,Species: At-Risk and Priority,Number of at-risk terrestrial plant species observed (84) ,Number of at-risk aquatic plant species,AQ_TOT_P,sum,count,"This map illustrates the total number of plant species associated with aquatic habitat that are listed as G1, G2, or in the federal endangered species program that may reside within each subwatershed (12-digit HUC). G1 and G2 denote Global Conservation Ranks classified by NatureServe."
Service2016,86,Species: At-Risk and Priority,Number of at-risk wetland animal species observed (85) ,Number of at-risk wetland animal species,WT_TOT_A,sum,count,"This map illustrates the total number of animal species associated with wetland habitat that are listed as G1, G2, or in the federal endangered species program that may reside within each subwatershed (12-digit HUC) for 2011. G1 and G2 denote Global Conservation Ranks classified by NatureServe."
Service2016,87,Species: At-Risk and Priority,Number of at-risk wetland plant species observed (86) ,Number of at-risk wetland plant species,WT_TOT_P,sum,count,"This map illustrates the total number of plant species associated with wetland habitat that are listed as G1, G2, or in the federal endangered species program that may reside within each subwatershed (12-digit HUC) for 2011. G1 and G2 denote Global Conservation Ranks classified by NatureServe."
Service2016,88,Crop Productivity ,Number of fruit crop types (annually) (87) ,Number of CDL Fruit Crops,FRUITCOUNT,sum,count,The number of CDL fruit crop types occuring in the 12-digit HUC
Service2016,89,Crop Productivity ,Number of grain crop types (annually) (88) ,Number of Grain Crops,GRAIN_COUN,sum,count,"Number of grain crops ( corn, barley, cotton, durum wheat, oats, rye, rice, sorghum, spring wheat, soybeans, and winter wheat) grown in the 12-digit HUC annually"
Service2016,90,"Water Supply, Runoff, and Flow",Number of high hazard potential dams (89) ,Number of high hazard potential dams,NIDamCount,sum,count,"This map depicts the number of high hazard potential dams within each subwatershed (12-digit HUC). For this map, EnviroAtlas uses the 2009 National Inventory of Dams maintained by the US Army Corps of Engineers."
Service2016,91,Engagement with Outdoors,Number of historic places (90) ,Historical Features Total,Total_Hist,sum,count,Total number of all historical features.
Service2016,92,Crop Productivity ,Number of vegetable crop types (annually) (91) ,Amout of Vegetables produced,VEGYIELDTONS,sum,tons per year,The amount of vegetables produced yearly in tons per 12-digit HUC.
Service2016,93,Wetlands and Lowlands,Percent agriculture on hydric soil (92) ,Percent agriculture on hydric soil ,PAGHYD80,average,%,"This map depicts the percentage of land managed for agriculture that has hydric soils within each subwatershed (12-digit HUC). This includes all land dedicated to the production of crops, but excludes land managed for pasture."
Service2016,94,Land Cover: Type,Percent cropland (93) ,Percent cropland,PAGC,average,%,"This map depicts the percent of land managed as cropland in each subwatershed (12-digit HUC). For this map, EnviroAtlas uses all crop types in the Cropland Data Layer created by the United States Department of Agriculture."
Service2016,95,Land Cover: Type,Percent developed area (94) ,Percent developed area,PDEV,average,%,"This map estimates the amount of developed land within each subwatershed (12-digit HUC) for 2011. For the purposes of this map, developed land cover includes a variety of development, such as single family homes, multifamily housing units, retail, commercial, industrial sites, and associated infrastructure. Developed land cover is not confined to city limits."
Service2016,96,Land Cover: Type,Percent emergent herbaceous wetlands (95) ,Percent emergent herbaceous wetlands,PWETL95,average,%,"This map depicts the percent of land comprised of emergent herbaceous wetlands in each subwatershed (12-digit HUC). For this map, EnviroAtlas uses the National Land Cover Database and its definition of  emergent herbaceous wetlands."
Service2016,97,Land Cover: Type,Percent forest (96) ,Percent forest,PFOR,average,%,This map illustrates the percentage of total land within each subwatershed (12-digit HUC) that is covered by trees and forest.
Service2016,98,Land Cover: Type,Percent forest and woody wetlands (97) ,Percent forest and woody wetlands,PFOR90,average,%,This map illustrates the percentage of total land within each subwatershed (12-digit HUC) that is covered by trees and forest or woody wetlands. EnviroAtlas uses the National Land Cover Database definition of woody wetlands.
Service2016,99,Land Cover: Near-Water,Percent forest and woody wetlands in stream buffer (98) ,Percent forest and woody wetlands in stream buffer,RFOR9030,average,%,"This EnviroAtlas national map portrays the percent of land within 45 meters of streams, rivers, and other hydrologically-connected waterbodies (e.g., lakes and ponds) covered by forest and woody wetlands within each 12-digit hydrologic unit (HUC)."
Service2016,100,Land Cover: Near-Water,Percent forest land in stream buffer (99) ,Percent forest land in stream buffer,RFOR30,average,%,"This EnviroAtlas national map portrays the percent of land within 45 meters of streams, rivers, and other hydrologically-connected waterbodies (e.g., lakes and ponds) covered by forest within each 12-digit hydrologic unit (HUC)."
Service2016,101,Protected Lands,Percent GAP status 1 and 2 (100) ,Percent GAP status 1 and 2,PGAPSTAT1_2,average,%,"This map illustrates the percent of land within a subwatershed (12-digit HUC) that is designated as Status 1 or 2 under the USGS Gap Analysis Program. These lands have permanent protections in place limiting visitation, use, and human impacts. Lands with status 1 have more restrictions in place to minimize disturbance and maintain the land's natural state."
Service2016,102,Protected Lands,"Percent GAP status 1, 2, and 3 (101) ","Percent GAP status 1, 2, and 3",PGAPSTAT123,average,%,This map illustrates the percent of land within subwatershed (12-digit HUC) that has legally recognized easements for conservation or other protections in place to restrict human use or development. This layer includes both public and private land.
Service2016,103,Protected Lands,Percent GAP status 3 (102) ,Percent GAP status 3,PGAPSTAT3,average,%,"This map illustrates the percent of land within a subwatershed (12-digit HUC) that is designated as Status 3 under the USGS Gap Analysis Program. These areas have permanent protection from conversion of natural land cover for the majority of area. Subject to extractive uses of either broad, low-intensity type (e.g.. Logging) or localized intense type (e.g.. Mining). Confers protection to federally listed endangered and threatened species throughout the area."
Service2016,104,Land Cover: Type,Percent impervious area (103) ,Percent impervious area,PIMPV,average,%,"This map illustrates the percent of total land within each subwatershed (12-digit HUC) that is impervious. Impervious surfaces do not allow the penetration of water and include buildings, roads, and sidewalks."
Service2016,105,Protected Lands,Percent IUCN status IA (104) ,Area classified as IUCN category Ia in the Protected Areas,PIUCN_IA,average,%,Percentage of WBD 12-digit Hydrologic Unit that is classified as IUCN category Ia in the Protected Areas Database of the United States (PAD-US) version 1.2 created by USGS GAP.
Service2016,106,Protected Lands,Percent IUCN status IB (105) ,Area classified as IUCN category Ib in the Protected Areas,PIUCN_IB,average,%,Percentage of WBD 12-digit Hydrologic Unit that is classified as IUCN category Ib in the Protected Areas Database of the United States (PAD-US) version 1.2 created by USGS GAP.
Service2016,107,Protected Lands,Percent IUCN status II (106) ,Area classified as IUCN category II in the Protected Areas,PIUCN_II,average,%,Percentage of WBD 12-digit Hydrologic Unit that is classified as IUCN category II in the Protected Areas Database of the United States (PAD-US) version 1.2 created by USGS GAP.
Service2016,108,Protected Lands,Percent IUCN status III (107) ,Area classified as IUCN category III in the Protected Area,PIUCN_III,average,%,Percentage of WBD 12-digit Hydrologic Unit that is classified as IUCN category III in the Protected Areas Database of the United States (PAD-US) version 1.2 created by USGS GAP.
Service2016,109,Protected Lands,Percent IUCN status IV (108) ,Area classified as IUCN category IV in the Protected Areas,PIUCN_IV,average,%,Percentage of WBD 12-digit Hydrologic Unit that is classified as IUCN category IV in the Protected Areas Database of the United States (PAD-US) version 1.2 created by USGS GAP.
Service2016,110,Protected Lands,Percent IUCN status V (109) ,Area classified as IUCN category V in the Protected Areas ,PIUCN_V,average,%,Percentage of WBD 12-digit Hydrologic Unit that is classified as IUCN category V in the Protected Areas Database of the United States (PAD-US) version 1.2 created by USGS GAP.
Service2016,111,Protected Lands,Percent IUCN status VI (110) ,Area classified as IUCN category VI in the Protected Areas,PIUCN_VI,average,%,Percentage of WBD 12-digit Hydrologic Unit that is classified as IUCN category VI in the Protected Areas Database of the United States (PAD-US) version 1.2 created by USGS GAP.
Service2016,112,Protected Lands,Percent land with any IUCN status (111) ,Area classified as IUCN classified areas,PIUCN_ALL,average,%,Percentage of WBD 12-digit Hydrologic Unit with IUCN classified areas in the Protected Areas Database of the United States (PAD-US) version 1.2 created by USGS GAP.
Service2016,113,Landscape Pattern,Percent large size patches of natural land cover (112) ,"Large patches of natural land cover (>25,000 acres)",NATLarge,average,%,"Percent large patches of natural land cover (>25,000 acres) in 12-digit HUC."
Service2016,114,Landscape Pattern,Percent medium size patches of natural land cover (113) ,"Medium patches of natural land cover (500 - 25,000 acres)",NATMedium,average,%,"Percent medium patches of natural land cover (500 - 25,000 acres) in 12-digit HUC."
Service2016,115,Land Cover: Type,Percent natural land cover (114) ,Percent natural land cover,N_INDEX,average,%,"This map illustrates the percent of total land within each subwatershed (12-digit HUC) that has natural land cover. Natural land cover includes forests, shrubs, grasslands, barren land, and wetlands; it excludes agriculture and impervious surfaces."
Service2016,116,Land Cover: Near-Water,Percent natural land cover in stream buffer (115) ,Percent natural land cover in stream buffer,RNAT45,average,%,"This EnviroAtlas national map portrays the percent of land within 45 meters of streams, rivers, and other hydrologically-connected waterbodies (e.g., lakes and ponds) covered by natural land cover within each 12-digit hydrologic unit (HUC)."
Service2016,117,Landscape Pattern,Percent of rare ecosystem forms protected (116) ,Percent of rare ecosystem forms protected,Percent_Rare_Area_Protected,average,%,"This map estimates the percent of land within each subwatershed (12-digit HUC) that could be classified as rare ecosystem forms that is protected for 2011. Ecosystem rarity in EnviroAtlas is based on size, shape, and type of ecosystem."
Service2016,118,Land Cover: Near-Water,Percent of stream and shoreline with 15% or more impervious cover within 30 meters (117) ,Percent of stream and shoreline with 15% or more impervious cover within 30 meters,strlak15p,average,%,Percentage of stream and water body shoreline lengths that had impervious cover greater than or equal to 15% within 30 meters for 2011.
Service2016,119,Land Cover: Near-Water,Percent of stream and shoreline with 5% or more impervious cover within 30 meters (118) ,Percent of stream and shoreline with 5% of more impervious cover within 30 meters,strlak5p,average,%,Percentage of stream and water body shoreline lengths that had impervious cover greater than or equal to 5% within 30 meters for 2011.
Service2016,120,Land Cover: Type,Percent pasture (119) ,Percent pasture,PAGP,average,%,This map depicts the percent of land managed as pasture in each subwatershed (12-digit HUC). Pasture areas are planted for livestock grazing or the production of seed or hay crops.
Service2016,121,Wetlands and Lowlands,Percent potentially restorable wetlands on agricultural land (120) ,Percent potentially restorable wetlands on agricultural land,PctPRWAg,average,%,This map estimates the percent of land within each subwatershed (12-digit HUC) that may be suitable for wetland restoration.
Service2016,122,Landscape Pattern,Percent rare ecosystem forms (121) ,Percent rare ecosystem forms,Percent_of_HUC_Rare,average,%,"This map estimates the percent of land within each subwatershed (12-digit HUC) that could be classified as rare ecosystem forms for 2011. Ecosystem rarity in EnviroAtlas is based on size, shape, and type of ecosystem."
Service2016,123,Landscape Pattern,Percent small size patches of natural land cover (122) ,Small patches of natural land cover (<500 acres),NATSmall,average,%,Percent small patches of natural land cover (<500 acres) in 12-digit HUC.
Service2016,124,Land Cover: Type,Percent wetlands (123) ,Percent wetlands,PWETL,average,%,"This map depicts the percent of land comprised of woody and emergent herbaceous wetlands in each subwatershed (12-digit HUC). For this map, EnviroAtlas uses the National Land Cover Database and its definitions of woody and emergent herbaceous wetlands."
Service2016,125,"Water Supply, Runoff, and Flow",Stream density (km/km2) (124) ,Stream density (km/km2),StreamDensity,average,km/km2,This map estimates the drainage density within each subwatershed (12-digit HUC). The density is equal to the total stream length in kilometers within a subwatershed divided by its total area in square kilometers.
Service2016,126,"Water Supply, Runoff, and Flow",Stream length (km) (125) ,Stream length (km),TotalLength,sum,km,"This map estimates the total kilometers of streams, rivers, or other linear waterways within each subwatershed (12-digit HUC). It includes both natural and man-made water features, but excludes non-linear waterbodies such as lakes."
Service2016,127,Impaired Waters,Stream length impaired by mercury (km) (126) ,Stream length impaired by mercury (km),MercuryImpLen,sum,km,This map depicts the total stream length in kilometers within the subwatershed (12-digit HUC) that has been listed as impaired by mercury for 2015-2016.
Service2016,128,Impaired Waters,Stream length impaired by metals other than mercury (km) (127) ,Stream length impaired by metals other than mercury (km),MetalsImpLen,sum,km,This map depicts the total stream length in kilometers within the subwatershed (12-digit HUC) that has been listed as impaired due to the presence of metals other than mercury in the water for 2015-2016.
Service2016,129,Impaired Waters,Stream length impaired by nuisance species (km) (128) ,Stream length impaired by nuisance species (km),NuisanceImpLen,sum,km,"This map depicts the total stream length in kilometers within the subwatershed (12-digit HUC) that has been listed as impaired by algal growth, noxious aquatic plants, and nuisance native or invasive plants, animals, fish, or microbes for 2015-2016."
Service2016,130,Impaired Waters,Stream length impaired by nutrients (km) (129) ,Stream length impaired by nutrients (km),NutImpLen,sum,km,This map depicts the total stream length in kilometers within the subwatershed (12-digit HUC) that has been listed as impaired due to the presence of nutrients in the water for 2015-2016.
Service2016,131,Impaired Waters,Stream length impaired by organic enrichment or oxygen depletion (km) (130) ,Stream length impaired by organic enrichment or oxygen depletion (km),OrgEnrO2DepImpLen,sum,km,This map depicts the total stream length in kilometers within the subwatershed (12-digit HUC) that has been listed as impaired by excessive organic materials or reduced oxygen for 2015-2016.
Service2016,132,Impaired Waters,Stream length impaired by pathogens (km) (131) ,Stream length impaired by pathogens (km),PathogenImpLen,sum,km,"This map depicts the total stream length in kilometers within the subwatershed (12-digit HUC) that has been listed as impaired by microbes, such as bacteria, that can spread disease for 2015-2016."
Service2016,133,Impaired Waters,Stream length impaired by pesticides (km) (132) ,Stream length impaired by pesticides (km),PesticidesImpLen,sum,km,"This map depicts the total stream length in kilometers within the subwatershed (12-digit HUC) that has been listed as impaired by pesticides, such as herbicide and insecticide for 2015-2016."
Service2016,134,Impaired Waters,"Stream length impaired by pH, acidity, or caustic conditions (km) (133) ","Stream length impaired by pH, acidity, or caustic conditions (km)",pHImpLen,sum,km,This map depicts the total stream length in kilometers within the subwatershed (12-digit HUC) that has been listed as impaired due to being too acidic or too alkaline for 2015-2016.
Service2016,135,Impaired Waters,Stream length impaired by sediment or turbidity (km) (134) ,Stream length impaired by sediment or turbidity (km),SedTurbImpLen,sum,km,This map depicts the total stream length in kilometers within the subwatershed (12-digit HUC) that has been listed as impaired by sediment or turbidity for 2015-2016.
Service2016,136,Impaired Waters,Stream length impaired for temperature (km) (135) ,Stream length impaired for temperature (km),TempImpLen,sum,km,This map depicts the total stream length in kilometers within the subwatershed (12-digit HUC) that has been listed as impaired for having higher than average temperature for 2015-2016.
Service2016,137,Impaired Waters,Stream length with any other impairment (km) (136) ,Stream length with any other impairment (km),OtherImpLen,sum,km,"This map depicts the total stream length in kilometers within the subwatershed (12-digit HUC) that has been listed as impaired due to any other cause, including flow alterations, habitat alterations, ammonia, biotoxins, chlorine, dioxins, oil and grease, PCBs, radiation, salinity, toxic substances, trash, taste, color, or odor for 2015-2016."
Service2016,138,Impaired Waters,Stream length with impaired biota (km) (137) ,Stream length with impaired biota (km),BiotaImpLen,sum,km,This map depicts the total stream length in kilometers within the subwatershed (12-digit HUC) that has been listed as impaired for biota. Biota or biological impairment is an indication of water quality and not necessarily the source of impairment.
Service2016,139,Pollutants: Nutrients,Synthetic nitrogen fertilizer application (kg N/ha/yr) (138) ,Synthetic nitrogen fertilizer application,SNFA_MEAN,average,kg-N/ha per year,This map depicts the mean rate of synthetic nitrogen fertilizer application to agricultural lands within each subwatershed (12-digit HUC) in kg N/ha/yr.
Service2016,140,Pollutants: Nutrients,Total annual nitrogen deposition (kg/ha) (139) ,Total annual nitrogen deposition,TD_N_T,sum,kg-N/ha per year,This map estimates the total annual deposition of nitrogen within each subwatershed (12-digit HUC) in kilograms per hectare. This map includes both dry and wet deposition of oxidized and reduced nitrogen.
Service2016,141,Pollutants: Nutrients,Total annual oxidized nitrogen deposition (kg/ha) (140) ,Total annual oxidized nitrogen deposition ,TD_OXN_T,sum,kg-N/ha per year,This map estimates the annual deposition of oxidized nitrogen within each subwatershed (12-digit HUC) in kilograms per hectare. This map includes both dry and wet deposition of oxidized nitrogen.
Service2016,142,Pollutants: Nutrients,Total annual reduced nitrogen deposition (kg/ha) (141) ,Total annual reduced nitrogen deposition ,TD_REDN_T,sum,kg-N/ha per year,This map estimates the annual deposition of reduced nitrogen within each subwatershed (12-digit HUC) in kilograms per hectare. This map includes both dry and wet deposition of reduced nitrogen.
Service2016,143,Pollutants: Nutrients,Total annual sulfur deposition (kg/ha) (142) ,Total Deposition of Total Sulfur,TD_S_T,sum,kg-S/ha per year,Total Deposition of Total Sulfur (kg-S/ha)
Service2016,144,Species: At-Risk and Priority,Total number of at-risk aquatic species observed (143) ,Total number of at-risk aquatic species,N/A,sum,count,"This map illustrates the total number of species associated with aquatic habitat that are listed as G1, G2, or in the federal endangered species program that may reside within each subwatershed (12-digit HUC)."
Service2016,145,Species: At-Risk and Priority,Total number of at-risk terrestrial species observed (144) ,Total number of at-risk terrestrial species,N/A,sum,count,"This map illustrates the total number of species associated with terrestrial habitat that are listed as G1, G2, or in the federal endangered species program that may reside within each subwatershed (12-digit HUC). G1 and G2 denote Global Conservation Ranks classified by NatureServe. Terrestrial habitat refers to land areas such as forests, grasslands, deserts and rainforests."
Service2016,146,Species: At-Risk and Priority,Total number of at-risk wetland species observed (145) ,Total number of at-risk wetland species,N/A,sum,count,"This map illustrates the total number of species associated with wetland habitat that are listed as G1, G2, or in the federal endangered species program that may reside within each subwatershed (12-digit HUC). G1 and G2 denote Global Conservation Ranks classified by NatureServe."
Service2016,147,Crop Productivity ,Value of cotton crops (dollars/yr) (146) ,Cotton sales,COT_DOLS,sum,dollars per year,Cotton sales in dollars annually
Service2016,148,Crop Productivity ,Value of grain crops (dollars/yr) (147) ,Grain sales,GRAIN_DOLS,sum,dollars per year,"Grain ( corn, barley, cotton, durum wheat, oats, rye, rice, sorghum, spring wheat, soybeans, and winter wheat) sales in dollars annually"
Service2016,149,Crop Productivity ,Vegetable yields (thousand tons/yr) (148) ,Vegetable yields (thousands tons/yr),VEGYIELD,sum,thousands of tons per year,This map depicts the thousands of tons of vegetable crops that are grown annually within each subwatershed (12-digit HUC).
