source_tx,sort_nu,category_name,rest_layer_name,label_tx,field_nm,statistic_cd,units_tx,description_tx
Service2016,1,Protected Lands,Acres of land enrolled in CRP (0) ,Acres of land enrolled in CRP,CRP_acres,sum,acres,This map portrays the acres of land within each subwatershed (12-digit HUC) that are enrolled in the US Department of Agriculture's Conservation Reserve Program (CRP). The CRP is a program administered by the Farm Service Agency; farmers in the program receive annual payments and establishment cost share to remove environmentally sensitive land from crop production and instead plant perennial species that provide environmental benefits.
Service2016,2,Crop Productivity ,Acres of pollinated crops with no nearby pollinator habitat (1) ,Acres of crops that have no nearby pollinator habitat,Acres_Unpo,sum,acres,"This map layer depicts the total acres of agricultural crops within a subwatershed (12-digit HUC) that require or would benefit from the presence of pollinators, but are without any nearby supporting habitat."
Service2016,3,Water Use,Agricultural water use (million gallons/day) (2) ,Agricultural water use,AWD_MGAL,sum,million gallons per day,"This map estimates the millions of gallons of water used daily for agricultural irrigation for each subwatershed (HUC-12) in the contiguous United States. Estimates include self-supplied surface and groundwater, as well as water supplied by irrigation water providers, which may include governments, companies, or other organizations."
Service2016,4,Pollutants: Nutrients,Annual oxidized nitrogen dry deposition (kg/ha) (3) ,Annual oxidized nitrogen dry deposition ,DD_OXN_T,average,kg-N/ha per year,This map estimates the annual dry deposition of oxidized nitrogen within each subwatershed (12-digit HUC) in kilograms per hectare. Dry deposition occurs when particles or gases attach to surfaces such as dust or smoke and fall to the earth's surface.
Service2016,5,Pollutants: Nutrients,Annual oxidized nitrogen wet deposition (kg/ha) (4) ,Annual oxidized nitrogen wet deposition,AWD_OXN_T,average,kg-N/ha per year,"This map estimates the annual wet deposition of oxidized nitrogen within each subwatershed (12-digit HUC) in kilograms per hectare. Wet deposition occurs when rain, snow, or fog carry nitrogen to the earth’s surface."
Service2016,6,Pollutants: Nutrients,Annual reduced nitrogen dry deposition (kg/ha) (5) ,Annual reduced nitrogen dry deposition ,DD_REDN_T,average,kg-N/ha per year,This map estimates the annual dry deposition of reduced nitrogen within each subwatershed (12-digit HUC) in kilograms per hectare. Dry deposition occurs when particles or gases attach to surfaces such as dust or smoke and fall to the earth's surface.
Service2016,7,Pollutants: Nutrients,Annual reduced nitrogen wet deposition (kg/ha) (6) ,Annual reduced nitrogen wet deposition ,AWD_REDN_T,average,kg-N/ha per year,"This map estimates the annual wet deposition of reduced nitrogen within each subwatershed (12-digit HUC) in kilograms per hectare. Wet deposition occurs when rain, snow, or fog carry nitrogen to the earth’s surface."
Service2016,8,Pollutants: Nutrients,Annual sulfur dry deposition (kg/ha) (7) ,Annual sulfur dry deposition ,DD_S_T,average,kg-S/ha per year,This map estimates the annual dry deposition of sulfur within each subwatershed (12-digit HUC) in kilograms per hectare. Dry deposition occurs when particles or gases attach to surfaces such as dust or smoke and fall to the earth's surface.
Service2016,9,Pollutants: Nutrients,Annual sulfur wet deposition (kg/ha) (8) ,Annual sulfur wet deposition ,AWD_S_T,average,kg-S/ha per year,"This map estimates the annual wet deposition of sulfur within each subwatershed (12-digit HUC) in kilograms per hectare. Wet deposition occurs when rain, snow, or fog carry sulfur to the earth’s surface."
Service2016,10,Energy Potential,Area of solar energy (km2) (9) ,Area of solar energy (km2),SolE_Area,sum,km2,This map estimates the square kilometers of area within each subwatershed (12-digit HUC) that offers the potential for harvesting solar energy for 2009. This map does not take into account land use or ownership.
Service2016,11,Energy Potential,Average annual daily potential solar energy (kWh/m2/day) (10) ,Average annual daily potential solar energy (kWh/m2/day),SolE_Mean,average,kWh/m2/day,This map estimates the average daily potential kilowatt hours of solar energy that could be harvested per square meter within each subwatershed (12-digit HUC) for 2009. This calculation is based on environmental factors and does not take into account land ownership or viability of installing solar harvesting systems.
Service2016,12,Energy Potential,Average annual daily potential wind energy (kWh/m2/day) (11) ,Average annual daily potential wind energy (kWh/m2/day),AvgWindEnergy,average,kWh/m2/day,"This map estimates the average daily potential kilowatt hours of wind energy that could be harvested per square meter within each subwatershed (12-digit HUC), based on data from 2001-2012. This calculation is based on environmental factors and does not take into account land ownership or viability of installing wind harvesting systems."
Service2016,13,Weather and Climate,Average annual precipitation (inches/yr) (12) ,Average Precipitation,MeanPrecip,average,inches per year,Average annual precipitation (inches)
Service2016,14,Engagement with Outdoors,Big game hunting recreation demand (13) ,Big game hunting recreation demand,BG_Demand,sum,number per year,This map illustrates the number of day trips per year demanded for big game hunting by individuals over the age of 18 within each subwatershed (12-digit HUC) for 2010-2011.
Service2016,15,Engagement with Outdoors,Bird watching recreation demand (14) ,Bird watching recreation demand,BW_Demand,sum,number per year,This map illustrates the number of day trips per year demanded for bird watching by individuals over the age of 18 within each subwatershed (12-digit HUC) for 2010-2011.
Service2016,16,Carbon Storage,Carbon storage by tree biomass (metric tons) (15) ,Carbon storage by tree biomass (metric tons),BMass_Tons,sum,metric tons,This map estimates the metric tons (megagrams) of dry carbon stored in above ground biomass of trees and forests in each subwatershed (12-digit HUC) for 2000.
Service2016,17,Carbon Storage,Carbon storage by tree root biomass (metric tons) (16) ,Carbon storage by tree root biomass (metric tons) ,Root_BMass_Tons,sum,metric tons,This map estimates the metric tons (megagrams) of dry carbon stored in below ground biomass in each subwatershed (12-digit HUC) for 2000. Biomass below ground includes tree root biomass and soils.
Service2016,18,Crop Productivity ,Cotton yields (thousand tons/yr) (17) ,Cotton yields (thousand tons/yr),COT_KTONS,sum,thousands of tons per year,This map depicts the thousands of tons of cotton that are grown annually within each subwatershed (12-digit HUC).
Service2016,19,Pollutant Reduction: Water,Cultivated biological nitrogen fixation (kg N/ha/yr) (18) ,Biological nitrogen fixation - cultivated,CBNF_Mean,average,kg-N/ha per year,Mean rate of cultivated biological nitrogen fixation in kg N/ha/yr per 12-digit HUC for 2006
Service2016,20,Water Use,Domestic water use (million gallons/day) (19) ,Domestic water use (million gallons/day),DWD_mgal,sum,million gallons per day,"This map estimates the millions of gallons of water used daily for domestic purposes in each subwatershed (HUC-12). For the purposes of this map, domestic or residential water use includes all indoor and outdoor uses, such as for drinking, bathing, cleaning, landscaping, and pools for primary residences."
Service2016,21,Engagement with Outdoors,Freshwater fishing recreation demand (20) ,Freshwater fishing recreation demand,FF_Demand,sum,number per year,This map illustrates the number of day trips per year demanded for freshwater fishing by individuals over the age of 18 within each subwatershed (12-digit HUC) for 2010-2011.
Service2016,22,Crop Productivity ,Fruit yields (thousand tons/yr) (21) ,Fruit yields (thousand tons/yr),FRUITYIELD,sum,thousands of tons per year,This map depicts the thousands of tons of fruit crops that are grown annually within each subwatershed (12-digit HUC).
Service2016,23,Crop Productivity ,Grain yields (thousand tons/yr) (22) ,Grain yields (thousand tons/yr),GRAIN_KTONS,sum,thousands of tons per year,This map depicts the thousands of tons of major grain crops that are grown annually within each subwatershed (12-digit HUC).
Service2016,24,Crop Productivity ,Hectares of cotton crops (23) ,Hectares of cotton crops,COT_HA,sum,hectares,This map depicts the total hectares managed for cotton crops annually within each subwatershed (12-digit HUC).
Service2016,25,Crop Productivity ,Hectares of fruit crops (24) ,Hectares of fruit crops,FRUITHECTARES,sum,hectares,This map depicts the total hectares managed for fruit crops annually within each subwatershed (12-digit HUC).
Service2016,26,Crop Productivity ,Hectares of grain crops (25) ,Hectares of grain crops,GRAIN_HA,sum,hectares,This map depicts the total hectares managed for major grain crops annually within each subwatershed (12-digit HUC).
Service2016,27,Crop Productivity ,Hectares of vegetable crops (26) ,Hectares of vegetable crops,VEGHECTARES,sum,hectares,This map depicts the total hectares managed for vegetable crops annually within each subwatershed (12-digit HUC).
Service2016,28,Pollutants: Nutrients,Manure application (kg N/ha/yr) (27) ,Manure Application to agricultural lands from confined animal feeding operations,ManureMean,average,kg-N/ha per year,This map depicts the mean rate of manure application to agricultural lands from confined animal feeding operations within each subwatershed (12-digit HUC) in kg N/ha/yr for 2006.
Service2016,29,Species: Other,Maximum amphibian species richness (28) ,Maximum number of amphibian species,AMPH_MAX,sum,count per pixel,The maximum number of amphibian species in any one pixel for each 12-digit HUC over the entire Southwest Region
Service2016,30,N/A,Maximum bat species richness (29) ,Maximum number of bat species,N/A,sum,count ,The maximum number of bat species in any one pixel for each 12-digit HUC over the entire Southeast Region
Service2016,31,Species: Other,Maximum big game species richness (30) ,Maximum number of big game species,BIGGA_MAX,sum,count per pixel,The maximum number of big game species in any one pixel for each 12-digit HUC over the entire Southwest Region
Service2016,32,Species: Other,Maximum bird species richness (31) ,Maximum number of bird species,Bird_All_MAX,sum,count per pixel,The maximum number of bird species in any one pixel for each 12-digit HUC over the entire contiguous US.
Service2016,33,Species: Other,Maximum fur bearer species richness (32) ,Fur bearer species richness,FURB_MAX,sum,count per pixel,"These maps model fur bearer species that are likely to be present in any single location within a subwatershed (12-digit HUC) in the Conterminous US as the maximum, mean, or NIB (index). These maps are based on habitat models, not wildlife observations."
Service2016,34,N/A,Maximum land cover diversity (33) ,N/A,N/A,N/A,N/A,N/A
Service2016,35,Species: Other,Maximum mammal species richness (34) ,Maximum mammal species richness,MAM_MAX,sum,count per pixel,"These maps model mammal species that are likely to be present in any single location within a subwatershed (12-digit HUC) in the Conterminous US as the maximum, mean, or NIB (index). These maps are based on habitat models, not wildlife observations."
Service2016,36,Species: At-Risk and Priority,Maximum modeled Partners in Flight Watch List bird species (35) ,Maximum number of Partners in Flight in their Watch List bird species,Bird_PIF_MAX,sum,count per pixel,The maximum number of bird species listed by Partners in Flight in their Watch List in any one pixel for each 12-digit HUC over the contiguous US.
Service2016,37,Species: At-Risk and Priority,Maximum modeled State of the Birds species of conservation concern (36) ,Maximum number of birds listed in the State of the Birds report (2011) as species of conservation concern,Bird_BCC_MAX,sum,count per pixel,The maximum number of birds listed in the State of the Birds report (2011) as species of conservation concern in any one pixel for each 12-digit HUC over the contiguous US.
Service2016,38,Species: At-Risk and Priority,Maximum modeled threatened and endangered vertebrate species (37) ,Maximum number of federal threatened and endangered species,TE_MAX,sum,count per pixel,The maximum number of federal threatened and endangered species in any one pixel for each 12-digit HUC over the entire Southwest Region
Service2016,39,Species: At-Risk and Priority,Maximum number of bird species vulnerable to range loss due to climate change by 2050 (38) ,Number of bird species vulnerable to range loss due to climate change by 2050,Bird_Aud_end_MAX,sum,count per pixel,"This map models the maximum number of Audubon Climate Endangered bird species (https://climate.audubon.org/) that are likely to be present in any single location within a subwatershed (12-digit HUC) in the Conterminous US for 2015. These are bird species vulnerable to a loss of 50% or more of current range due to climate change by 2050. This map is based on habitat models, not wildlife observations. The maximum number does not represent the potential richness for the entire watershed."
Service2016,40,Species: At-Risk and Priority,Maximum number of bird species vulnerable to range loss due to climate change by 2080 (39) ,Number of bird species vulnerable to range loss due to climate change by 2080,Bird_Aud_thr_MAX,sum,count per pixel,"This map models the maximum number of Audubon Climate Threatened bird species (https://climate.audubon.org/) that are likely to be present in any single location within a subwatershed (12-digit HUC) in the Conterminous US for 2015. These are bird species vulnerable to a loss of 50% or more of current range due to climate change by 2080. This map is based on habitat models, not wildlife observations. The maximum number does not represent the potential richness for the entire watershed."
Service2016,41,Species: Other,Maximum reptile species richness (40) ,Maxium Number of Reptile species,Rep_All_MAX,sum,count per pixel,The maximum number of Reptile species in any one pixel for each 12-digit HUC over the contiguous US.
Service2016,42,Species: Other,Maximum small game species richness (41) ,Maximum number of small game species,SMGA_MAX,sum,count per pixel,The maximum number of small game species in any one pixel for each 12-digit HUC over the entire Southwest Region
Service2016,43,Species: Other,Maximum total harvestable species richness (42) ,Total harvestable species richness,HARV_MAX,sum,count per pixel,"These maps model harvestable species that are likely to be present in any single location within a subwatershed (12-digit HUC) in the Conterminous US as the maximum, mean, or NIB (index). These maps are based on habitat models, not wildlife observations."
Service2016,44,Species: Other,Maximum total vertebrate species richness (43) ,Maximum number of terrestrial vertebrate species,TerrVert_Max,sum,count per pixel,The maximum number of terrestrial vertebrate species in any one pixel for each 12-digit HUC over the entire Southwest Region
Service2016,45,Species: Other,Maximum waterfowl species richness (44) ,Maximum number of waterfowl species,WTFL_MAX,sum,count per pixel,The maximum number of waterfowl species in any one pixel for each 12-digit HUC over the entire Southwest Region
Service2016,46,Species: Other,Mean amphibian species richness (45) ,Mean number of amphibian species,Amph_Mean,average,count per pixel,The mean number of amhibian species per pixel for each 12-digit HUC over the entire Southwest Region
Service2016,47,N/A,Mean bat species richness (46) ,Mean number of bat species,N/A,average,count per pixel,The mean number of bat species per pixel for each 12-digit HUC over the entire Southwest Region
Service2016,48,Species: Other,Mean big game species richness (47) ,Mean number of big game species,BigGa_Mean,average,count per pixel,The mean number of big game species per pixel for each 12-digit HUC over the entire Southwest Region
Service2016,49,Species: Other,Mean bird species richness (48) ,Mean number of bird species,Bird_All_MEAN,average,count per pixel,The mean number of bird species per pixel for each 12-digit HUC over the contiguous US.
Service2016,50,Species: Other,Mean fur bearer species richness (49) ,Mean number of furbearing species,Furb_Mean,average,count per pixel,The mean number of furbearer species per pixel for each 12-digit HUC over the entire Southwest Region
Service2016,51,N/A,Mean land cover diversity (50) ,N/A,N/A,N/A,N/A,N/A
Service2016,52,Species: Other,Mean mammal species richness (51) ,Mean number of mammal species,Mam_Mean,average,count per pixel,The mean number of mammal species per pixel for each 12-digit HUC over the entire Southwest Region
Service2016,53,Species: At-Risk and Priority,Mean modeled Partners in Flight Watch List bird species (52) ,Mean number of Partners in Flight in their Watch List bird species,Bird_PIF_MEAN,average,count per pixel,The mean number of bird species listed by Partners in Flight in their Watch List per pixel for each 12-digit HUC over the contiguous US.
Service2016,54,Species: At-Risk and Priority,Mean modeled State of the Birds species of conservation concern (53) ,Mean number of birds listed in the State of the Birds report (2011) as species of conservation concern,Bird_BCC_MEAN,average,count per pixel,The mean number of bird species listed in the State of the Birds report (2011) as species of conservation concern per pixel for each 12-digit HUC over the contiguous US.
Service2016,55,Species: At-Risk and Priority,Mean modeled threatened and endangered vertebrate species (54) ,Mean number of federal threatened and endangered species,TE_Mean,average,count per pixel,The mean number of federal threatened and endangered species per pixel for each 12-digit HUC over the entire Southwest Region
Service2016,56,Species: At-Risk and Priority,Mean number of bird species vulnerable to range loss due to climate change by 2050 (55) ,Mean number of bird species vulnerable to range loss due to climate change by 2050,Bird_Aud_end_MEAN,average,count per pixel,"This map models the mean number of Audubon Climate Endangered bird species (https://climate.audubon.org/) that are likely to be present in any single location within a subwatershed (12-digit HUC) in the Conterminous US for 2015. These are bird species vulnerable to a loss of 50% or more of current range due to climate change by 2050. This map is based on habitat models, not wildlife observations. "
Service2016,57,Species: At-Risk and Priority,Mean number of bird species vulnerable to range loss due to climate change by 2080 (56) ,Mean number of bird species vulnerable to range loss due to climate change by 2080,Bird_Aud_thr_MEAN,average,count per pixel,"This map models the mean number of Audubon Climate Threatened bird species (https://climate.audubon.org/) that are likely to be present in any single location within a subwatershed (12-digit HUC) in the Conterminous US for 2015. These are bird species vulnerable to a loss of 50% or more of current range due to climate change by 2080. This map is based on habitat models, not wildlife observations. "
Service2016,58,Species: Other,Mean reptile species richness (57) ,Mean number of reptile species richness,Rep_All_MEAN,average,count,"These maps model reptile species that are likely to be present in any single location within a subwatershed (12-digit HUC) in the Conterminous US as the maximum, mean, or NIB (index). These maps are based on habitat models, not wildlife observations."
Service2016,59,Species: Other,Mean small game species richness (58) ,Mean number of small game species,SMGA_Mean,average,count per pixel,The mean number of small game species per pixel for each 12-digit HUC over the entire Southwest Region
Service2016,60,Species: Other,Mean total harvestable species richness (59) ,Mean number of harvestable species,Harv_Mean,average,count per pixel,The mean number of harvestable species per pixel for each 12-digit HUC over the entire Southwest Region
Service2016,61,Species: Other,Mean total vertebrate species richness (60) ,Mean number of terrestrial vertebrate species,TerrVert_Mean,average,count per pixel,The mean number of terrestrial vertebrate species per pixel for each 12-digit HUC over the entire Southwest Region
Service2016,62,Species: Other,Mean waterfowl species richness (61) ,Mean number of waterfowl species,Wtfl_Mean,average,count per pixel,The mean number of waterfowl species per pixel for each 12-digit HUC over the entire Southwest Region
Service2016,63,Engagement with Outdoors,Migratory bird hunting recreation demand (62) ,Migratory bird hunting recreation demand,MB_Demand,sum,number per year,This map illustrates the number of day trips per year demanded for migratory bird hunting by individuals over the age of 18 within each subwatershed (12-digit HUC) for 2010-2011.
Service2016,64,Pollutant Reduction: Water,Natural biological nitrogen fixation (kg N/ha/yr) (63) ,Natural biological nitrogen fixation ,BNF,average,kg-N/ha per year,This map depicts mean biological nitrogen fixation in natural and semi-natural ecosystems within each subwatershed (12-digit HUC) in kg N/ha/yr.
Service2016,65,Species: Other,NIB amphibian species richness (64) ,Index of amphibian species,Amph_NIB,average,unitless,The index of average (mean number of amphibian species per pixel divided by the maximum number of amphibian species in any one pixel for the entire study area) for each 12-digit HUC over the entire Southwest Region
Service2016,66,N/A,NIB bat species richness (65) ,N/A,N/A,N/A,N/A,N/A
Service2016,67,Species: Other,NIB big game species richness (66) ,Index of big game species,BigGa_NIB,average,unitless,The index of average (mean number of big game species per pixel divided by the maximum number of big game species in any one pixel for the entire study area) for each 12-digit HUC over the entire Southwest Region
Service2016,68,Species: Other,NIB bird species richness (67) ,Index of bird species,Bird_All_NIB,average,unitless,The Bird All Normalized Index of Biodiversity (NIB) was calculated by dividing the mean species richness value of each HUC by the maximum value for the study area (the contiguous US).
Service2016,69,Species: Other,NIB fur bearer species richness (68) ,Index of furbearing species,Furb_NIB,average,unitless,The index of average (mean number of furbearer species per pixel divided by the maximum number of furbearer species in any one pixel for the entire study area) for each 12-digit HUC over the entire Southwest Region
Service2016,70,N/A,NIB land cover diversity (69) ,N/A,N/A,N/A,N/A,N/A
Service2016,71,Species: Other,NIB mammal species richness (70) ,Index of mammal species,Mam_NIB,average,unitless,The index of average (mean number of mammal species per pixel divided by the maximum number of mammal species in any one pixel for the entire study area) for each 12-digit HUC over the entire Southwest Region
Service2016,72,Species: At-Risk and Priority,NIB modeled Partners in Flight Watch List bird species (71) ,Index of Bird Partners in Flight Normalized Index of Biodiversity bird species,Bird_PIF_NIB,average,unitless,The Bird Partners in Flight Normalized Index of Biodiversity (NIB) was calculated by dividing the mean species richness value of each HUC by the maximum value for the study area (the contiguous US).
Service2016,73,Species: At-Risk and Priority,NIB modeled State of the Birds species of conservation concern (72) ,Index of Bird of Conservation Concern species,Bird_BCC_NIB,average,unitless,The Bird of Conservation Concern Normalized Index of Biodiversity (NIB) was calculated by dividing the mean species richness value of each HUC by the maximum value for the study area (the contiguous US).
Service2016,74,Species: At-Risk and Priority,NIB modeled threatened and endangered vertebrate species (73) ,Index of federal threatened and endangered species,TE_NIB,average,unitless,The index of average (mean number of federal threatened and endangered species per pixel divided by the maximum number of federal threatened and endangered species in any one pixel for the entire study area) for each 12-digit HUC over the entire Southwest Region
Service2016,75,Species: At-Risk and Priority,NIB number of bird species vulnerable to range loss due to climate change by 2050 (74) ,Index of bird species vulnerable to range loss due to climate change by 2050,Bird_Aud_end_NIB,average,unitless,"This map models the NIB of Audubon Climate Endangered bird species (https://climate.audubon.org/) that are likely to be present in any single location within a subwatershed (12-digit HUC) in the Conterminous US for 2015. These are bird species vulnerable to a loss of 50% or more of current range due to climate change by 2050. This map is based on habitat models, not wildlife observations."
Service2016,76,Species: At-Risk and Priority,NIB number of bird species vulnerable to range loss due to climate change by 2080 (75) ,Index of bird species vulnerable to range loss due to climate change by 2080,Bird_Aud_thr_NIB,average,unitless,"This map models the NIB of Audubon Climate Threatened bird species (https://climate.audubon.org/) that are likely to be present in any single location within a subwatershed (12-digit HUC) in the Conterminous US for 2015. These are bird species vulnerable to a loss of 50% or more of current range due to climate change by 2080. This map is based on habitat models, not wildlife observations. "
